{
  "schema_version": "trajecta.m3.tolerances/v1",
  "algorithm_id": "trajecta/met_query/m3/v0",
  "registry_version": "m3-a-tolerance/v1.0.2",
  "approved_at_utc": "2026-07-20T08:41:05Z",
  "approval_authority": "A",
  "calibration_report": {
    "path": "testdata/M3_TOLERANCE_CALIBRATION.v1.json",
    "sha256": "c097417f96cde49751372bb56cac141766f1f660830b74b879adbf7514ffb520",
    "state": "measured_partial"
  },
  "rules": [
    {
      "id": "backend/era5-pressure/netcdf-exact/v1",
      "selector": {
        "dataset_families": [
          "era5_pressure"
        ],
        "comparison_target": "backend_equivalence",
        "comparison_variant": "rust-netcdf-vs-native-netcdf",
        "sample_scope": "decoded_field",
        "field_namespace": "source_identity",
        "fields": [
          "pressure:t",
          "pressure:u",
          "pressure:v",
          "pressure:q",
          "pressure:w",
          "pressure:z",
          "surface:sp",
          "surface:z",
          "surface:u10",
          "surface:v10",
          "surface:t2m",
          "surface:d2m",
          "surface:ishf",
          "surface:ie",
          "surface:blh",
          "surface:fsr",
          "surface:zust"
        ],
        "coordinates": [
          "all"
        ],
        "vertical_regions": [
          "all"
        ]
      },
      "decision": "hard_gate",
      "exact_metadata": [
        "valid_times",
        "grid",
        "vertical_topology",
        "layout",
        "mask",
        "unit",
        "temporal_support"
      ],
      "mask_policy": "exact",
      "non_finite_policy": "reject",
      "metric": {
        "kind": "exact",
        "equality": "numeric",
        "signed_zero_equal": true
      },
      "threshold_basis": "measured_envelope",
      "evidence_ids": [
        "calibration:era5-pressure-netcdf-windows-2026-07-18"
      ],
      "scientific_reason": "Both readers decode the same stored NetCDF numeric payload; all three times and every required source field measured exact on the frozen official anchor."
    },
    {
      "id": "backend/era5-hybrid/netcdf-exact/v1",
      "selector": {
        "dataset_families": [
          "era5_hybrid"
        ],
        "comparison_target": "backend_equivalence",
        "comparison_variant": "rust-netcdf-vs-native-netcdf",
        "sample_scope": "decoded_field",
        "field_namespace": "source_identity",
        "fields": [
          "hybrid:t",
          "hybrid:u",
          "hybrid:v",
          "hybrid:q",
          "hybrid:w",
          "hybrid:sp",
          "hybrid:lnsp",
          "surface:z",
          "surface:u10",
          "surface:v10",
          "surface:t2m",
          "surface:d2m",
          "surface:ishf",
          "surface:ie",
          "surface:blh",
          "surface:fsr",
          "surface:zust"
        ],
        "coordinates": [
          "all"
        ],
        "vertical_regions": [
          "all"
        ]
      },
      "decision": "hard_gate",
      "exact_metadata": [
        "valid_times",
        "grid",
        "vertical_topology",
        "layout",
        "mask",
        "unit",
        "temporal_support"
      ],
      "mask_policy": "exact",
      "non_finite_policy": "reject",
      "metric": {
        "kind": "exact",
        "equality": "numeric",
        "signed_zero_equal": true
      },
      "threshold_basis": "measured_envelope",
      "evidence_ids": [
        "calibration:era5-hybrid-netcdf-windows-2026-07-18"
      ],
      "scientific_reason": "Both readers decode the same stored NetCDF numeric payload; the complete three-time hybrid, lnsp, and surface source matrix measured exact on the frozen official anchor."
    },
    {
      "id": "backend/cfsr-grib/exact-fields/v1",
      "selector": {
        "dataset_families": [
          "cfsr_pressure"
        ],
        "comparison_target": "backend_equivalence",
        "comparison_variant": "rust-grib-vs-native-eccodes",
        "sample_scope": "decoded_field",
        "field_namespace": "source_identity",
        "fields": [
          "grib:0.0.0:isobaric",
          "grib:0.2.2:isobaric",
          "grib:0.2.3:isobaric",
          "grib:0.3.0:surface",
          "grib:0.3.5:surface"
        ],
        "coordinates": [
          "all"
        ],
        "vertical_regions": [
          "all"
        ]
      },
      "decision": "hard_gate",
      "exact_metadata": [
        "valid_times",
        "grid",
        "vertical_topology",
        "layout",
        "mask",
        "unit",
        "temporal_support"
      ],
      "mask_policy": "exact",
      "non_finite_policy": "reject",
      "metric": {
        "kind": "exact",
        "equality": "numeric",
        "signed_zero_equal": true
      },
      "threshold_basis": "measured_envelope",
      "evidence_ids": [
        "calibration:cfsr-grib-three-times-windows-2026-07-18"
      ],
      "scientific_reason": "Temperature, horizontal wind, surface pressure, and surface height decode exactly across Rust GRIB and ecCodes for all three frozen CFSR times."
    },
    {
      "id": "backend/cfsr-grib/q-three-ulp/v1",
      "selector": {
        "dataset_families": [
          "cfsr_pressure"
        ],
        "comparison_target": "backend_equivalence",
        "comparison_variant": "rust-grib-vs-native-eccodes",
        "sample_scope": "decoded_field",
        "field_namespace": "source_identity",
        "fields": [
          "grib:0.1.0:isobaric"
        ],
        "coordinates": [
          "all"
        ],
        "vertical_regions": [
          "all"
        ]
      },
      "decision": "hard_gate",
      "exact_metadata": [
        "valid_times",
        "grid",
        "vertical_topology",
        "layout",
        "mask",
        "unit",
        "temporal_support"
      ],
      "mask_policy": "exact",
      "non_finite_policy": "reject",
      "metric": {
        "kind": "ulp",
        "maximum_ulps": 3,
        "signed_zero_equal": true
      },
      "threshold_basis": "measured_envelope",
      "evidence_ids": [
        "calibration:cfsr-grib-three-times-windows-2026-07-18"
      ],
      "scientific_reason": "Specific humidity differs by at most three binary64 ULPs across all three frozen CFSR times; the worst points are tied to the same 5 hPa JPEG2000 message packing and have an absolute difference near 3.1e-25."
    },
    {
      "id": "backend/cfsr-grib/omega-two-ulp/v1",
      "selector": {
        "dataset_families": [
          "cfsr_pressure"
        ],
        "comparison_target": "backend_equivalence",
        "comparison_variant": "rust-grib-vs-native-eccodes",
        "sample_scope": "decoded_field",
        "field_namespace": "source_identity",
        "fields": [
          "grib:0.2.8:isobaric"
        ],
        "coordinates": [
          "all"
        ],
        "vertical_regions": [
          "all"
        ]
      },
      "decision": "hard_gate",
      "exact_metadata": [
        "valid_times",
        "grid",
        "vertical_topology",
        "layout",
        "mask",
        "unit",
        "temporal_support"
      ],
      "mask_policy": "exact",
      "non_finite_policy": "reject",
      "metric": {
        "kind": "ulp",
        "maximum_ulps": 2,
        "signed_zero_equal": true
      },
      "threshold_basis": "measured_envelope",
      "evidence_ids": [
        "calibration:cfsr-grib-three-times-windows-2026-07-18"
      ],
      "scientific_reason": "Pressure vertical velocity differs by at most two binary64 ULPs after equivalent decimal-scaled GRIB reconstruction across all three frozen CFSR times, so its existing threshold remains unchanged."
    },
    {
      "id": "oracle/native-anchor/vector-wind/v1",
      "selector": {
        "dataset_families": [
          "era5_hybrid"
        ],
        "comparison_target": "flexpart_common_semantics",
        "comparison_variant": "trajecta-vs-flexpart-v11.1",
        "sample_scope": "native_anchor",
        "field_namespace": "transport_output",
        "fields": [
          "eastward_wind",
          "northward_wind"
        ],
        "coordinates": [
          "native_level"
        ],
        "vertical_regions": [
          "upper_air"
        ]
      },
      "decision": "hard_gate",
      "exact_metadata": [
        "status",
        "validity",
        "unit"
      ],
      "mask_policy": "exact",
      "non_finite_policy": "reject",
      "metric": {
        "kind": "vector",
        "component_absolute": 2e-05,
        "component_relative": 5e-07,
        "component_scale_floor": 0.1,
        "speed_floor": 0.1,
        "direction_degrees": 0.02
      },
      "threshold_basis": "preregistered_precision_budget",
      "evidence_ids": [
        "flexpart:dace3affa2ba71677f12f3858b04aaf59f8ee51e:real32-wind-storage",
        "numeric:binary32-eight-ulp-envelope"
      ],
      "scientific_reason": "At exact source time, grid point, and native level the implementations share wind semantics; the bound covers FLEXPART binary32 storage and a small decoder rounding envelope without hiding interpolation errors."
    },
    {
      "id": "oracle/native-anchor/temperature/v1",
      "selector": {
        "dataset_families": [
          "era5_hybrid"
        ],
        "comparison_target": "flexpart_common_semantics",
        "comparison_variant": "trajecta-vs-flexpart-v11.1",
        "sample_scope": "native_anchor",
        "field_namespace": "transport_output",
        "fields": [
          "air_temperature"
        ],
        "coordinates": [
          "native_level"
        ],
        "vertical_regions": [
          "upper_air"
        ]
      },
      "decision": "hard_gate",
      "exact_metadata": [
        "status",
        "validity",
        "unit"
      ],
      "mask_policy": "exact",
      "non_finite_policy": "reject",
      "metric": {
        "kind": "absolute_relative",
        "absolute": 0.0002,
        "relative": 5e-07,
        "scale_floor": 1.0
      },